{
  "capabilities": [
    {
      "local_available": true,
      "name": "nextstat_fit",
      "server_available": true,
      "server_policy": {
        "availability": "exposed",
        "reason": "Exposed on the restricted nextstat-server tool surface.",
        "reason_code": "server_safe_subset"
      }
    },
    {
      "local_available": true,
      "name": "nextstat_hypotest",
      "server_available": true,
      "server_policy": {
        "availability": "exposed",
        "reason": "Exposed on the restricted nextstat-server tool surface.",
        "reason_code": "server_safe_subset"
      }
    },
    {
      "local_available": true,
      "name": "nextstat_hypotest_toys",
      "server_available": true,
      "server_policy": {
        "availability": "exposed",
        "reason": "Exposed on the restricted nextstat-server tool surface.",
        "reason_code": "server_safe_subset"
      }
    },
    {
      "local_available": true,
      "name": "nextstat_upper_limit",
      "server_available": true,
      "server_policy": {
        "availability": "exposed",
        "reason": "Exposed on the restricted nextstat-server tool surface.",
        "reason_code": "server_safe_subset"
      }
    },
    {
      "local_available": true,
      "name": "nextstat_ranking",
      "server_available": true,
      "server_policy": {
        "availability": "exposed",
        "reason": "Exposed on the restricted nextstat-server tool surface.",
        "reason_code": "server_safe_subset"
      }
    },
    {
      "local_available": true,
      "name": "nextstat_discovery_asymptotic",
      "server_available": true,
      "server_policy": {
        "availability": "exposed",
        "reason": "Exposed on the restricted nextstat-server tool surface.",
        "reason_code": "server_safe_subset"
      }
    },
    {
      "local_available": true,
      "name": "nextstat_scan",
      "server_available": true,
      "server_policy": {
        "availability": "exposed",
        "reason": "Exposed on the restricted nextstat-server tool surface.",
        "reason_code": "server_safe_subset"
      }
    },
    {
      "local_available": true,
      "name": "nextstat_workspace_audit",
      "server_available": true,
      "server_policy": {
        "availability": "exposed",
        "reason": "Exposed on the restricted nextstat-server tool surface.",
        "reason_code": "server_safe_subset"
      }
    },
    {
      "local_available": true,
      "name": "nextstat_read_root_histogram",
      "server_available": true,
      "server_policy": {
        "availability": "exposed",
        "reason": "Exposed on the restricted nextstat-server tool surface.",
        "reason_code": "server_safe_subset"
      }
    },
    {
      "local_available": true,
      "name": "nextstat_glm_fit",
      "server_available": true,
      "server_policy": {
        "availability": "exposed",
        "reason": "Exposed on the restricted nextstat-server tool surface.",
        "reason_code": "server_safe_subset"
      }
    },
    {
      "local_available": true,
      "name": "nextstat_bayesian_sample",
      "server_available": true,
      "server_policy": {
        "availability": "exposed",
        "reason": "Exposed on the restricted nextstat-server tool surface.",
        "reason_code": "server_safe_subset"
      }
    },
    {
      "local_available": true,
      "name": "nextstat_survival_fit",
      "server_available": true,
      "server_policy": {
        "availability": "exposed",
        "reason": "Exposed on the restricted nextstat-server tool surface.",
        "reason_code": "server_safe_subset"
      }
    },
    {
      "local_available": true,
      "name": "nextstat_kaplan_meier",
      "server_available": true,
      "server_policy": {
        "availability": "exposed",
        "reason": "Exposed on the restricted nextstat-server tool surface.",
        "reason_code": "server_safe_subset"
      }
    },
    {
      "local_available": true,
      "name": "nextstat_log_rank_test",
      "server_available": true,
      "server_policy": {
        "availability": "exposed",
        "reason": "Exposed on the restricted nextstat-server tool surface.",
        "reason_code": "server_safe_subset"
      }
    },
    {
      "local_available": true,
      "name": "nextstat_panel_fe",
      "server_available": true,
      "server_policy": {
        "availability": "exposed",
        "reason": "Exposed on the restricted nextstat-server tool surface.",
        "reason_code": "server_safe_subset"
      }
    },
    {
      "local_available": true,
      "name": "nextstat_did",
      "server_available": true,
      "server_policy": {
        "availability": "exposed",
        "reason": "Exposed on the restricted nextstat-server tool surface.",
        "reason_code": "server_safe_subset"
      }
    },
    {
      "local_available": true,
      "name": "nextstat_iv_2sls",
      "server_available": true,
      "server_policy": {
        "availability": "exposed",
        "reason": "Exposed on the restricted nextstat-server tool surface.",
        "reason_code": "server_safe_subset"
      }
    },
    {
      "local_available": true,
      "name": "nextstat_aipw",
      "server_available": true,
      "server_policy": {
        "availability": "exposed",
        "reason": "Exposed on the restricted nextstat-server tool surface.",
        "reason_code": "server_safe_subset"
      }
    },
    {
      "local_available": true,
      "name": "nextstat_meta_analysis",
      "server_available": true,
      "server_policy": {
        "availability": "exposed",
        "reason": "Exposed on the restricted nextstat-server tool surface.",
        "reason_code": "server_safe_subset"
      }
    },
    {
      "local_available": true,
      "name": "nextstat_kalman",
      "server_available": true,
      "server_policy": {
        "availability": "exposed",
        "reason": "Exposed on the restricted nextstat-server tool surface.",
        "reason_code": "server_safe_subset"
      }
    },
    {
      "local_available": true,
      "name": "nextstat_ads_cuped_adjust",
      "server_available": true,
      "server_policy": {
        "availability": "exposed",
        "reason": "Exposed on the restricted nextstat-server tool surface.",
        "reason_code": "server_safe_subset"
      }
    },
    {
      "local_available": true,
      "name": "nextstat_ads_cure_adjust",
      "server_available": true,
      "server_policy": {
        "availability": "exposed",
        "reason": "Exposed on the restricted nextstat-server tool surface.",
        "reason_code": "server_safe_subset"
      }
    },
    {
      "local_available": true,
      "name": "nextstat_churn_generate_data",
      "server_available": true,
      "server_policy": {
        "availability": "exposed",
        "reason": "Exposed on the restricted nextstat-server tool surface.",
        "reason_code": "server_safe_subset"
      }
    },
    {
      "local_available": true,
      "name": "nextstat_churn_risk_model",
      "server_available": true,
      "server_policy": {
        "availability": "exposed",
        "reason": "Exposed on the restricted nextstat-server tool surface.",
        "reason_code": "server_safe_subset"
      }
    },
    {
      "local_available": true,
      "name": "nextstat_churn_retention",
      "server_available": true,
      "server_policy": {
        "availability": "exposed",
        "reason": "Exposed on the restricted nextstat-server tool surface.",
        "reason_code": "server_safe_subset"
      }
    },
    {
      "local_available": true,
      "name": "nextstat_churn_compare",
      "server_available": true,
      "server_policy": {
        "availability": "exposed",
        "reason": "Exposed on the restricted nextstat-server tool surface.",
        "reason_code": "server_safe_subset"
      }
    },
    {
      "local_available": true,
      "name": "nextstat_churn_diagnostics",
      "server_available": true,
      "server_policy": {
        "availability": "exposed",
        "reason": "Exposed on the restricted nextstat-server tool surface.",
        "reason_code": "server_safe_subset"
      }
    },
    {
      "local_available": true,
      "name": "nextstat_churn_cohort_matrix",
      "server_available": true,
      "server_policy": {
        "availability": "exposed",
        "reason": "Exposed on the restricted nextstat-server tool surface.",
        "reason_code": "server_safe_subset"
      }
    },
    {
      "local_available": true,
      "name": "nextstat_churn_bootstrap_hr",
      "server_available": true,
      "server_policy": {
        "availability": "exposed",
        "reason": "Exposed on the restricted nextstat-server tool surface.",
        "reason_code": "server_safe_subset"
      }
    },
    {
      "local_available": true,
      "name": "nextstat_churn_ingest",
      "server_available": true,
      "server_policy": {
        "availability": "exposed",
        "reason": "Exposed on the restricted nextstat-server tool surface.",
        "reason_code": "server_safe_subset"
      }
    },
    {
      "local_available": true,
      "name": "nextstat_churn_uplift",
      "server_available": true,
      "server_policy": {
        "availability": "exposed",
        "reason": "Exposed on the restricted nextstat-server tool surface.",
        "reason_code": "server_safe_subset"
      }
    },
    {
      "local_available": true,
      "name": "nextstat_churn_uplift_survival",
      "server_available": true,
      "server_policy": {
        "availability": "exposed",
        "reason": "Exposed on the restricted nextstat-server tool surface.",
        "reason_code": "server_safe_subset"
      }
    },
    {
      "local_available": true,
      "name": "nextstat_chain_ladder",
      "server_available": true,
      "server_policy": {
        "availability": "exposed",